<Payload xmlns="http://javaops.ru"
         xmlns:xsi="http://www.w3.org/2001/XMLSchema-instance"
         xsi:schemaLocation="http://javaops.ru payload.xsd">
    <Users>
        <User email="gmail@gmail.com" flag="active" city="kiv">
            <fullName>Full Name</fullName>
            <groupIds>masterjava01</groupIds>
        </User>
        <User email="admin@javaops.ru" flag="superuser" city="spb">
            <fullName>Admin</fullName>
            <groupIds>masterjava01</groupIds>
        </User>
        <User email="mail@yandex.ru" flag="deleted" city="spb">
            <fullName>Deleted</fullName>
            <groupIds>masterjava01</groupIds>
        </User>
    </Users>
    <Cities>
        <City id="spb">Санкт-Петербург</City>
        <City id="kiv">Киев</City>
        <City id="mnsk">Минск</City>
    </Cities>
    <Projects>
        <Project id="masterjava">
            <name>masterjava</name>
            <description>For seniour</description>
        </Project>
    </Projects>
    <Groups>
        <Group id="masterjava01">
            <projectId>masterjava</projectId>
            <name>masterjava01</name>
            <type>CURRENT</type>
        </Group>
    </Groups>
</Payload>